number,values_0,values_1,datetime_start,datetime_complete,duration,params_imp_type,params_isomorphic,params_kd_dropout,params_kd_lamb,params_kd_lr,params_kd_momentum,params_kd_norm,params_kd_residual,params_kd_scheduler,params_kd_smoothing,params_kd_warnup,params_kd_weight_decay,params_lr,params_mpp_lr,params_mpp_scheduler,params_mpp_warnup,params_mpp_weight_decay,params_prune_mlp,params_prune_rate,params_prune_step,params_prune_type,params_scheduler,params_warnup,params_weight_decay,system_attrs_NSGAIISampler:generation,state
0,0.9417484551072338,0.9395674300254453,2025-05-07 03:30:16.643950,2025-05-07 03:32:39.522483,0 days 00:02:22.878533,lamp,False,,0.6,6.50569687196347e-05,0.9,,,True,0.0,0.4,0.0523480425663031,0.0005790686881517194,8.518458890025467e-05,False,,1.1632767931047873e-05,True,0.8999999999999999,2,group,True,0.4,0.0004157620536305369,0,COMPLETE
1,0.9327517266448564,0.9163031624863686,2025-05-07 03:32:39.545544,2025-05-07 03:35:27.900186,0 days 00:02:48.354642,lamp,False,,0.7000000000000001,0.0006881610859957616,0.99,,,True,0.15000000000000002,0.1,0.06147362698576337,0.0007721997348787808,2.8753704763750675e-05,False,,0.5318314393900692,True,0.7,2,bnscale,True,0.30000000000000004,0.08552673329898525,0,COMPLETE
2,0.9474736459469284,0.6452199200290804,2025-05-07 03:35:27.921996,2025-05-07 03:38:06.454169,0 days 00:02:38.532173,lamp,True,,0.9,0.0020362327015917264,0.8,,,True,0.1,0.35000000000000003,8.809402524290832e-05,0.005231208962424493,0.005170306914193728,False,,0.0003433856895856245,True,0.7,1,bnscale,False,,0.04975255060933723,0,COMPLETE
3,0.9091239549254816,0.8871319520174481,2025-05-07 03:38:06.477453,2025-05-07 03:40:58.517322,0 days 00:02:52.039869,fpgm,False,0.55,0.2,0.0075543871772109465,0.99,batch,True,True,0.05,0.25,1.2170988242476711e-05,1.9652650867831745e-05,0.00029267898564308185,False,,0.0001766559352454535,False,0.7,1,base,True,0.30000000000000004,0.4061219205044629,0,COMPLETE
4,0.9486550345328971,0.9426572155579788,2025-05-07 03:40:58.540092,2025-05-07 03:43:24.744796,0 days 00:02:26.204704,fpgm,False,0.7000000000000001,0.30000000000000004,2.668052945430874e-05,0.8,layer,False,False,0.15000000000000002,,0.023231680693106927,0.0025040603862966446,1.1286677030419244e-05,False,,0.34572424791362055,False,0.8999999999999999,3,base,False,,0.0003302814702336559,0,COMPLETE
5,0.952835332606325,0.9414758269720102,2025-05-07 03:43:24.768114,2025-05-07 03:45:49.777165,0 days 00:02:25.009051,lamp,True,,0.6,3.9103593268371775e-05,0.9,,,True,0.25,0.35000000000000003,0.00533031029641211,5.640558728183893e-05,3.0256382075780217e-05,False,,0.001686865318044768,True,0.7999999999999999,1,group,True,0.15000000000000002,0.021799063316397256,0,COMPLETE
6,0.8904943656852055,0.843784078516903,2025-05-07 03:45:49.798351,2025-05-07 03:48:34.443801,0 days 00:02:44.645450,group,True,,0.6,6.955580874113162e-05,0.995,,,True,0.15000000000000002,0.2,0.8339483498508722,0.0028741809401496878,0.0017827396637082385,False,,0.0215316246802468,True,0.7999999999999999,3,bnscale,True,0.15000000000000002,0.1791730610658639,0,COMPLETE
7,0.9417484551072337,0.9300254452926208,2025-05-07 03:48:34.465129,2025-05-07 03:51:06.942353,0 days 00:02:32.477224,fpgm,False,,0.7000000000000001,0.007469303005746991,0.995,,,False,0.15000000000000002,,0.0014019938206909584,2.2879895950918598e-05,0.00023806283551112566,False,,0.0037005747720516824,True,0.8999999999999999,3,group,True,0.1,0.021190337651985077,0,COMPLETE
8,0.9484732824427481,0.940567066521265,2025-05-07 03:51:06.964701,2025-05-07 03:53:46.235580,0 days 00:02:39.270879,fpgm,True,0.45000000000000007,0.4,0.0017547595680488814,0.99,batch,True,False,0.05,,0.015708191598901324,2.129603347272809e-05,0.000325607394703577,True,0.35000000000000003,0.05271696034937954,False,0.7999999999999999,2,group,False,,3.6920773301670025e-05,0,COMPLETE
9,0.24818247909850963,0.9430207197382771,2025-05-07 03:53:46.257005,2025-05-07 03:56:35.395331,0 days 00:02:49.138326,lamp,False,0.7000000000000001,0.30000000000000004,0.0017535956422833677,0.9,,True,True,0.2,0.35000000000000003,0.08983265129383361,0.007311746224592852,0.0008591042619647957,False,,0.00010451317865363885,False,0.7,1,base,False,,0.000495733138355239,0,COMPLETE
10,0.900945110868775,0.9456561250454381,2025-05-07 03:56:35.418408,2025-05-07 03:59:07.099058,0 days 00:02:31.680650,group,False,,0.8,0.004326172797366964,0.8,,,True,0.25,0.45,0.2361412834140158,0.0034638789194280746,7.379243499166124e-05,False,,0.0009008047955630662,True,0.7999999999999999,2,bnscale,False,,1.796000212070025e-05,0,COMPLETE
11,0.9543802253725918,0.9422937113776809,2025-05-07 03:59:07.121806,2025-05-07 04:02:08.777430,0 days 00:03:01.655624,lamp,False,0.1,0.2,0.0004136685287804947,0.99,,True,False,0.25,,1.061763532103298e-05,5.939878174659865e-05,0.0003368820901597603,False,,0.0011182408594745822,False,0.7,3,base,True,0.25,1.1605599347941741e-05,0,COMPLETE
12,0.5155398037077427,0.9183933115230826,2025-05-07 04:02:08.803887,2025-05-07 04:05:08.926860,0 days 00:03:00.122973,fpgm,False,0.8,0.1,5.9014511905783104e-05,0.9,,True,False,0.2,,0.0003613111906074476,0.0010430683798563457,0.00010395805268037536,True,0.30000000000000004,1.0216542719559137e-05,False,0.7,3,bnscale,True,0.0,0.08369554398818924,0,COMPLETE
13,0.5110868774990913,0.9422937113776809,2025-05-07 04:05:08.950031,2025-05-07 04:07:51.550437,0 days 00:02:42.600406,fpgm,True,,0.8,0.0020246205276636653,0.995,,,False,0.05,,0.7574188886339053,6.304730865571441e-05,0.0001161209435541452,False,,0.00011390514148491303,True,0.7,1,group,True,0.25,0.007223857989297222,0,COMPLETE
14,0.8944020356234098,0.9428389676481279,2025-05-07 04:07:51.572246,2025-05-07 04:10:09.239154,0 days 00:02:17.666908,group,False,0.2,0.6,0.0023571273886078426,0.9,layer,False,True,0.05,0.25,0.11233528048183912,0.0010877029127586955,0.0032579901069666496,False,,0.00031742729578524244,False,0.7999999999999999,1,base,False,,2.2147025521869703e-05,0,COMPLETE
15,0.4502908033442385,0.9446564885496184,2025-05-07 04:10:09.264110,2025-05-07 04:12:34.211229,0 days 00:02:24.947119,fpgm,True,0.4,0.9,1.4478953548579492e-05,0.8,,False,False,0.1,,0.0003718007988615981,0.0005442697417696576,0.0003379899745840217,False,,4.652516005541682e-05,False,0.7999999999999999,3,bnscale,False,,8.756984826145542e-05,0,COMPLETE
16,0.8963104325699746,0.9449291166848419,2025-05-07 04:12:34.232905,2025-05-07 04:15:17.407920,0 days 00:02:43.175015,fpgm,False,,0.1,0.009421821292822803,0.9,,,True,0.2,0.30000000000000004,0.06945484987191826,0.0025560451306477785,0.002113070152341859,True,0.45,4.542960748550809e-05,True,0.7,1,bnscale,False,,2.9584508406594442e-05,0,COMPLETE
17,0.3857688113413304,0.9278444202108324,2025-05-07 04:15:17.430022,2025-05-07 04:17:45.022548,0 days 00:02:27.592526,group,False,0.65,0.5,2.7403047286914024e-05,0.8,,True,True,0.25,0.2,0.0003448133517242703,0.00024079198516801647,0.0003624020793268723,False,,0.000527703660400242,False,0.8999999999999999,1,base,True,0.0,0.0457564572294909,0,COMPLETE
18,0.9208469647400945,0.9417484551072337,2025-05-07 04:17:45.042962,2025-05-07 04:20:27.388921,0 days 00:02:42.345959,fpgm,False,,0.5,0.0003216026150938328,0.99,,,False,0.05,,0.0959201213071867,4.916068665830748e-05,0.007478188716572893,False,,6.297856613280895e-05,True,0.7,1,base,False,,0.013139435112809881,0,COMPLETE
19,0.9477462740821521,0.932660850599782,2025-05-07 04:20:27.409873,2025-05-07 04:23:04.512703,0 days 00:02:37.102830,lamp,False,,0.6,1.3314801019875387e-05,0.9,,,False,0.3,,0.0015062712611207242,1.907542207075142e-05,9.944866579551102e-05,False,,0.00024120528217625183,True,0.7999999999999999,3,group,False,,0.05794089874786731,0,COMPLETE
20,0.9506543075245365,0.9455652490003635,2025-05-07 04:23:04.536364,2025-05-07 04:25:28.360349,0 days 00:02:23.823985,group,False,0.30000000000000004,0.9,0.000376659791826702,0.8,layer,False,True,0.1,0.05,0.006618643502469511,0.005688432124062522,0.0004216217432396529,False,,0.00034177204091961585,False,0.7999999999999999,2,base,False,,6.900572300191299e-05,0,COMPLETE
21,0.720192657215558,0.9382951653944019,2025-05-07 04:25:28.383078,2025-05-07 04:27:49.809272,0 days 00:02:21.426194,lamp,False,,0.2,0.009529706525794747,0.9,,,True,0.1,0.0,0.023768502174250746,7.55571537029978e-05,7.014600807536167e-05,True,0.4,0.2258478473011271,True,0.8999999999999999,1,bnscale,False,,0.001405765234164792,0,COMPLETE
22,0.9515630679752817,0.9440203562340966,2025-05-07 04:27:49.831586,2025-05-07 04:30:41.100724,0 days 00:02:51.269138,fpgm,True,0.25,0.4,0.0015311712788364015,0.995,batch,True,True,0.05,0.1,0.025823165657464106,0.0004881920073898895,0.009347943933625811,True,0.0,0.00013069958298220867,False,0.7,1,base,True,0.2,0.0028738453292449346,0,COMPLETE
23,0.9585605234460196,0.9429298436932024,2025-05-07 04:30:41.122155,2025-05-07 04:33:23.128676,0 days 00:02:42.006521,lamp,False,0.7000000000000001,0.5,0.00013748456345768302,0.8,batch,True,True,0.15000000000000002,0.0,0.00011815952337386297,0.009992559508668043,0.00026655084344404063,True,0.25,0.015002861849513235,False,0.8999999999999999,3,group,True,0.35000000000000003,0.00010131925704801792,0,COMPLETE
24,0.5870592511813886,0.9406579425663395,2025-05-07 04:33:23.151575,2025-05-07 04:36:31.362815,0 days 00:03:08.211240,group,True,,0.30000000000000004,0.0032198894775623986,0.8,,,False,0.25,,0.051777300437736824,0.007924418678376332,0.00082433356124805,False,,0.2536715541080339,True,0.7,3,bnscale,True,0.1,5.253460084264352e-05,0,COMPLETE
25,0.9536532170119957,0.9423845874227554,2025-05-07 04:36:31.384784,2025-05-07 04:39:19.307869,0 days 00:02:47.923085,group,False,0.25,0.4,0.0005314248900894629,0.9,layer,True,False,0.25,,0.009682404766704277,0.008865551929363545,1.1642743427609234e-05,True,0.2,1.0892002434635337e-05,False,0.7999999999999999,3,group,False,,0.000777337323058955,0,COMPLETE
26,0.9561977462740822,0.942657215557979,2025-05-07 04:39:19.329581,2025-05-07 04:41:43.234692,0 days 00:02:23.905111,group,False,0.5,0.5,0.0008255841439502921,0.99,layer,False,True,0.05,0.4,0.0010486648073056931,0.0022001157019900888,1.427931834155834e-05,False,,0.5016590271239284,False,0.7999999999999999,2,base,True,0.5,0.003944122728304339,0,COMPLETE
27,0.9262995274445656,0.72546346782988,2025-05-07 04:41:43.259558,2025-05-07 04:44:31.232560,0 days 00:02:47.973002,fpgm,False,,0.1,0.005766457967520233,0.8,,,True,0.3,0.15000000000000002,0.00017694720021407755,5.1320784028097344e-05,0.0023339936915648257,False,,0.23474494075573363,True,0.7999999999999999,3,base,False,,0.09245438894351161,0,COMPLETE
28,0.955288985823337,0.9409305707015632,2025-05-07 04:44:31.258033,2025-05-07 04:47:03.401616,0 days 00:02:32.143583,lamp,True,0.15000000000000002,0.2,0.00035197869670829275,0.99,layer,True,True,0.1,0.45,0.0003847246682478006,0.0013951749669731763,0.003913156219223261,True,0.05,0.0002900707225443017,False,0.8999999999999999,1,group,False,,0.0016575769150108844,0,COMPLETE
29,0.9505634314794621,0.9434750999636495,2025-05-07 04:47:03.425002,2025-05-07 04:49:43.931712,0 days 00:02:40.506710,lamp,False,0.30000000000000004,0.5,0.001086904929290907,0.9,batch,True,False,0.05,,2.636382686716318e-05,0.001405386241385563,0.0015338028741823206,True,0.45,1.638175550189804e-05,False,0.7999999999999999,2,bnscale,False,,0.0031885252208065807,0,COMPLETE
30,0.9353871319520174,0.9306615776081425,2025-05-07 04:49:43.953176,2025-05-07 04:52:03.962512,0 days 00:02:20.009336,fpgm,False,,0.2,0.00040542053825898803,0.8,,,False,0.3,,0.0047665718196158394,2.2607457455291094e-05,0.002261448714247936,False,,0.0004144768050633952,True,0.8999999999999999,1,group,False,,7.394389265494007e-05,0,COMPLETE
31,0.8646855688840421,0.9437477280988732,2025-05-07 04:52:03.983432,2025-05-07 04:54:17.635146,0 days 00:02:13.651714,group,False,0.4,0.9,0.0005409121760056357,0.995,batch,False,True,0.0,0.1,0.25090146667416463,0.0040512291991694534,0.0014828021175756075,False,,3.420129164460875e-05,False,0.7999999999999999,1,group,True,0.05,1.302607764353242e-05,0,COMPLETE
32,0.3426026899309342,0.886041439476554,2025-05-07 04:54:17.657295,2025-05-07 04:56:48.838114,0 days 00:02:31.180819,lamp,False,0.55,0.9,1.0394832663389318e-05,0.995,,False,False,0.3,,0.00015477134048816417,0.0004182554885296366,1.6320955059867962e-05,True,0.2,0.22222894490594278,False,0.7,1,group,True,0.4,0.5177100235647224,0,COMPLETE
33,0.8948564158487823,0.9433842239185751,2025-05-07 04:56:48.862368,2025-05-07 04:59:14.690398,0 days 00:02:25.828030,group,True,0.55,0.5,0.007393784255397785,0.995,,False,True,0.2,0.45,0.0005253209966076575,0.003390760788166217,0.00039917525675703245,False,,3.0033189816488443e-05,False,0.7999999999999999,3,base,True,0.30000000000000004,0.0011217893447614392,0,COMPLETE
34,0.9367502726281353,0.8424209378407852,2025-05-07 04:59:14.712331,2025-05-07 05:01:41.718389,0 days 00:02:27.006058,lamp,False,,0.5,0.0009621447460924636,0.99,,,False,0.25,,0.0011383004824145559,8.139778652741012e-05,0.003033698331582024,False,,0.06648927245785241,True,0.8999999999999999,2,base,True,0.15000000000000002,0.6512139455639705,0,COMPLETE
35,0.9317520901490367,0.8455107233733189,2025-05-07 05:01:41.739281,2025-05-07 05:04:22.749491,0 days 00:02:41.010210,lamp,True,0.8,0.5,0.00019130471615050912,0.99,batch,True,True,0.1,0.4,0.021523814284295673,0.0011349339112177686,0.0021054019215629377,True,0.05,0.4336230461633338,False,0.7999999999999999,2,group,True,0.25,0.42995563876994514,0,COMPLETE
36,0.8129770992366412,0.9373864049436569,2025-05-07 05:04:22.773619,2025-05-07 05:06:48.851161,0 days 00:02:26.077542,fpgm,True,,0.6,0.0020145801360438786,0.99,,,False,0.3,,0.08109287888701089,0.005776622365612826,0.0012019538435195261,False,,0.00017993858901931673,True,0.8999999999999999,2,base,True,0.35000000000000003,1.063503336496911e-05,0,COMPLETE
37,0.9190294438386042,0.5675209014903672,2025-05-07 05:06:48.872779,2025-05-07 05:09:27.539907,0 days 00:02:38.667128,fpgm,False,,0.5,0.00019164413071996454,0.99,,,True,0.05,0.25,0.5345692338809658,0.0018416140004243577,1.1120792674444516e-05,True,0.45,0.00027350494321933054,True,0.7,1,bnscale,False,,0.31961954597697995,0,COMPLETE
38,0.9334787350054525,0.8558705925118139,2025-05-07 05:09:27.563897,2025-05-07 05:11:51.814127,0 days 00:02:24.250230,group,True,,0.4,5.461194037224958e-05,0.9,,,True,0.2,0.15000000000000002,0.00035309765011084333,1.3584608042721568e-05,0.004993505833714923,False,,2.0659030597146714e-05,True,0.7999999999999999,1,bnscale,False,,0.654267980460917,0,COMPLETE
39,0.9581061432206471,0.9425663395129044,2025-05-07 05:11:51.835469,2025-05-07 05:14:19.640027,0 days 00:02:27.804558,group,True,,0.9,0.0007823080164489361,0.99,,,False,0.1,,0.001549193963887577,3.746500256884944e-05,0.0006630702884320486,False,,2.2941928585237643e-05,True,0.7999999999999999,2,base,False,,0.00041726133939488426,0,COMPLETE
40,0.9150308978553253,0.9450199927299164,2025-05-07 05:14:19.661039,2025-05-07 05:17:13.846108,0 days 00:02:54.185069,fpgm,False,0.7000000000000001,0.4,0.0010334494526840028,0.9,,True,True,0.05,0.05,0.00043942902597610096,0.0011715639578781692,1.942164884206245e-05,True,0.35000000000000003,0.0008766513615942525,False,0.7,2,group,True,0.45,0.002178190561647153,0,COMPLETE
41,0.8655943293347873,0.9264812795347147,2025-05-07 05:17:13.869248,2025-05-07 05:19:46.635381,0 days 00:02:32.766133,fpgm,False,,0.5,0.004644707882562093,0.8,,,True,0.3,0.25,0.15970420283807865,3.6530144644713746e-05,4.23373833180836e-05,True,0.25,0.922301326259863,True,0.8999999999999999,3,base,False,,0.20075577826112373,0,COMPLETE
42,0.923391494002181,0.9441112322791713,2025-05-07 05:19:46.658513,2025-05-07 05:22:22.903184,0 days 00:02:36.244671,lamp,True,0.6,0.5,0.00880593137840017,0.9,batch,True,False,0.05,,0.033194482460580335,0.0017232211699212089,1.0427282863157648e-05,False,,0.08890827885303305,False,0.7999999999999999,1,group,False,,0.0006467629165880778,0,COMPLETE
43,0.6501272264631043,0.9408396946564886,2025-05-07 05:22:22.926983,2025-05-07 05:25:16.229471,0 days 00:02:53.302488,group,False,0.8,0.5,4.787504466067963e-05,0.9,,True,True,0.25,0.5,3.758515137790037e-05,0.003933912165571096,4.6502532181230504e-05,True,0.2,1.1064735805379834e-05,False,0.7,2,bnscale,True,0.05,0.004546529631593033,0,COMPLETE
44,0.9413849509269356,0.9412031988367865,2025-05-07 05:25:16.251106,2025-05-07 05:27:52.489137,0 days 00:02:36.238031,lamp,False,,0.30000000000000004,0.0002951723135461657,0.9,,,True,0.05,0.35000000000000003,0.03475312364792154,0.0010941067133859658,7.440577900128453e-05,True,0.1,0.49689706266016237,True,0.8999999999999999,3,bnscale,False,,0.0010511920782767315,0,COMPLETE
45,0.9538349691021447,0.9376590330788804,2025-05-07 05:27:52.511550,2025-05-07 05:30:15.444726,0 days 00:02:22.933176,lamp,False,,0.4,0.0013025699731041044,0.9,,,True,0.15000000000000002,0.35000000000000003,0.0005945446686144185,1.620672856977081e-05,0.0003904291968684268,False,,0.7554608738310938,True,0.8999999999999999,1,group,False,,0.0006484862990363244,0,COMPLETE
46,0.22737186477644497,0.8868593238822245,2025-05-07 05:30:15.466380,2025-05-07 05:32:57.780940,0 days 00:02:42.314560,fpgm,False,0.8,0.9,0.0056836247604793,0.99,,True,False,0.15000000000000002,,0.015330813844048372,1.243692845780976e-05,0.00022113119333654998,True,0.0,1.0149442691612073e-05,False,0.7999999999999999,3,base,False,,0.4353284192797107,0,COMPLETE
47,0.31979280261723014,0.9433842239185749,2025-05-07 05:32:57.803532,2025-05-07 05:35:38.224278,0 days 00:02:40.420746,lamp,False,0.5,0.30000000000000004,5.6929893397598105e-05,0.9,,False,False,0.3,,0.012723676909865651,2.1324225268138047e-05,1.5146694580183068e-05,True,0.2,0.00013463084756543147,False,0.7,3,bnscale,False,,1.4353004930508628e-05,0,COMPLETE
48,0.9042166484914577,0.9152126499454744,2025-05-07 05:35:38.246282,2025-05-07 05:38:03.627678,0 days 00:02:25.381396,fpgm,False,,0.30000000000000004,0.0003976200647190032,0.8,,,True,0.0,0.2,0.27178559724949863,1.8420663369026976e-05,2.82482935295639e-05,True,0.5,0.10130398850485853,True,0.7999999999999999,2,group,True,0.5,0.1268788969927398,0,COMPLETE
49,0.9394765539803708,0.7777171937477281,2025-05-07 05:38:03.649090,2025-05-07 05:40:42.392479,0 days 00:02:38.743389,fpgm,False,0.65,0.8,0.0006244323624493025,0.99,layer,False,True,0.1,0.4,0.012616356983563571,0.00026201051020526174,0.0017015007598818524,False,,0.36338111775616394,False,0.7999999999999999,3,bnscale,True,0.4,0.6110653928487192,0,COMPLETE
50,0.9445656125045439,0.9352053798618685,2025-05-07 05:40:42.417458,2025-05-07 05:43:10.212864,0 days 00:02:27.795406,lamp,True,,0.6,3.9103593268371775e-05,0.9,,,True,0.25,0.1,0.033194482460580335,0.0017232211699212089,1.0427282863157648e-05,False,,0.08890827885303305,True,0.7999999999999999,1,group,True,0.2,0.021799063316397256,1,COMPLETE
51,0.9292075608869502,0.9415667030170848,2025-05-07 05:43:10.236383,2025-05-07 05:46:07.850365,0 days 00:02:57.613982,fpgm,True,0.7000000000000001,0.8,0.0032198894775623986,0.8,batch,True,False,0.25,,0.051777300437736824,0.007924418678376332,4.6502532181230504e-05,False,,0.2536715541080339,False,0.7,2,bnscale,True,0.1,0.004546529631593033,1,COMPLETE
52,0.9573791348600508,0.9424754634678298,2025-05-07 05:46:07.873742,2025-05-07 05:48:31.415426,0 days 00:02:23.541684,lamp,False,0.15000000000000002,0.5,0.0008255841439502921,0.99,layer,False,True,0.05,0.25,0.0005469137426431943,0.0010941067133859658,1.427931834155834e-05,False,,0.49689706266016237,False,0.8999999999999999,3,bnscale,True,0.05,0.003944122728304339,1,COMPLETE
53,0.9495637949836423,0.9417484551072337,2025-05-07 05:48:31.440840,2025-05-07 05:50:52.594933,0 days 00:02:21.154093,group,True,0.5,0.4,4.787504466067963e-05,0.99,layer,False,True,0.05,0.25,0.015708191598901324,2.129603347272809e-05,0.000325607394703577,True,0.35000000000000003,0.05271696034937954,False,0.7999999999999999,2,group,True,0.4,3.6920773301670025e-05,1,COMPLETE
54,0.9451108687749911,0.9379316612141041,2025-05-07 05:50:52.618202,2025-05-07 05:53:17.573621,0 days 00:02:24.955419,fpgm,True,,0.6,0.0005505888514601139,0.9,,,True,0.25,0.2,0.033194482460580335,0.0017232211699212089,1.0427282863157648e-05,False,,0.08890827885303305,True,0.7999999999999999,1,group,True,0.30000000000000004,0.021799063316397256,1,COMPLETE
55,0.8840421664849146,0.9097600872410032,2025-05-07 05:53:17.594082,2025-05-07 05:55:49.884306,0 days 00:02:32.290224,group,True,,0.1,0.000376659791826702,0.8,,,True,0.1,0.1,0.006618643502469511,0.005688432124062522,0.0004216217432396529,False,,0.001686865318044768,True,0.7999999999999999,2,group,True,0.1,0.021799063316397256,1,COMPLETE
56,0.6116866593965831,0.923391494002181,2025-05-07 05:55:49.906417,2025-05-07 05:58:25.274457,0 days 00:02:35.368040,fpgm,False,,0.5,0.004644707882562093,0.9,,,False,0.05,,0.15970420283807865,3.6530144644713746e-05,0.0015338028741823206,True,0.15000000000000002,1.638175550189804e-05,True,0.7999999999999999,3,base,False,,0.20075577826112373,1,COMPLETE
57,0.9515630679752817,0.9389312977099237,2025-05-07 05:58:25.298788,2025-05-07 06:01:07.491174,0 days 00:02:42.192386,fpgm,False,0.25,0.9,0.007469303005746991,0.995,layer,True,False,0.1,,0.0014019938206909584,0.0005442697417696576,0.0003379899745840217,False,,4.652516005541682e-05,False,0.8999999999999999,3,group,False,,8.756984826145542e-05,1,COMPLETE
