number,values_0,values_1,datetime_start,datetime_complete,duration,params_imp_type,params_isomorphic,params_lr,params_mpp_lr,params_mpp_scheduler,params_mpp_warnup,params_mpp_weight_decay,params_prune_mlp,params_prune_rate,params_prune_step,params_prune_type,params_scheduler,params_warnup,params_weight_decay,system_attrs_NSGAIISampler:generation,state
85,0.8126666666666665,0.6,2025-05-08 23:21:24.316075,2025-05-08 23:21:39.395724,0 days 00:00:15.079649,group,True,0.0011232041525995262,0.0007108408344005356,True,0.45,0.11560743688352852,True,0.6,3,group,False,,0.00019123815410159725,1,COMPLETE
86,0.7023333333333333,0.7,2025-05-08 23:21:39.420085,2025-05-08 23:21:52.232590,0 days 00:00:12.812505,fpgm,False,5.2381886385508624e-05,0.00023068683921798083,True,0.30000000000000004,0.014215603188618288,True,0.7,2,group,False,,1.5214863800383314e-05,1,COMPLETE
87,0.6493333333333333,0.8,2025-05-08 23:21:52.254550,2025-05-08 23:22:05.068802,0 days 00:00:12.814252,lamp,True,0.00016075206172279214,6.002013539834828e-05,True,0.25,3.506433890904232e-05,True,0.8,2,base,True,0.2,0.00048042866178479637,1,COMPLETE
88,0.7993333333333333,0.5,2025-05-08 23:22:05.091978,2025-05-08 23:22:17.859174,0 days 00:00:12.767196,fpgm,True,0.00036382827303909325,0.00012802008221638822,True,0.45,0.010013194334139178,False,0.5,2,group,False,,0.00048042866178479637,1,COMPLETE
89,0.7656666666666666,0.9,2025-05-08 23:22:17.880510,2025-05-08 23:22:28.467301,0 days 00:00:10.586791,fpgm,True,0.005857774530334977,9.805884111663247e-05,True,0.15000000000000002,0.0008910267266300254,True,0.9,1,bnscale,True,0.30000000000000004,0.0006809905577488475,1,COMPLETE
90,0.7443333333333334,0.5,2025-05-08 23:22:28.486147,2025-05-08 23:22:43.498011,0 days 00:00:15.011864,fpgm,True,5.2381886385508624e-05,0.0008161414858047086,True,0.4,0.0016670147218645457,True,0.5,3,bnscale,False,,0.0018661442794191704,1,COMPLETE
91,0.773,0.7,2025-05-08 23:22:43.521923,2025-05-08 23:22:54.033380,0 days 00:00:10.511457,group,True,0.00017061117751405585,0.0007108408344005356,True,0.2,0.027661712976156466,True,0.7,1,base,False,,0.004225615782818286,1,COMPLETE
92,0.8043333333333335,0.6,2025-05-08 23:22:54.052178,2025-05-08 23:23:06.761195,0 days 00:00:12.709017,lamp,True,0.001408949666300017,2.992071893340395e-05,True,0.35000000000000003,0.3804790976535149,True,0.6,2,bnscale,True,0.2,0.00012578563545305755,1,COMPLETE
93,0.8246666666666665,0.6,2025-05-08 23:23:06.782861,2025-05-08 23:23:17.663028,0 days 00:00:10.880167,fpgm,True,0.0016566513052075171,7.119110792490992e-05,True,0.45,3.268112256460199e-05,False,0.6,1,group,False,,0.006769458950097789,1,COMPLETE
94,0.8099999999999999,0.6,2025-05-08 23:23:17.683339,2025-05-08 23:23:32.891991,0 days 00:00:15.208652,fpgm,True,0.0007169704947021829,5.513575021987841e-05,True,0.4,3.506433890904232e-05,True,0.6,3,base,False,,0.040753905638393394,1,COMPLETE
95,0.8003333333333332,0.8,2025-05-08 23:23:32.914557,2025-05-08 23:23:48.019551,0 days 00:00:15.104994,group,False,0.0013213001570845813,0.004742696157908033,False,,0.00011170227944689261,False,0.8,3,base,False,,0.013025844590593572,1,COMPLETE
96,0.6676666666666667,0.9,2025-05-08 23:23:48.042222,2025-05-08 23:24:03.736460,0 days 00:00:15.694238,group,False,0.0006890698659809933,6.773348952132933e-05,True,0.5,1.0918536428284536e-05,True,0.9,3,group,True,0.1,1.622268967011596e-05,1,COMPLETE
97,0.5603333333333333,0.8,2025-05-08 23:24:03.760389,2025-05-08 23:24:14.894934,0 days 00:00:11.134545,fpgm,True,4.3593245709282796e-05,3.5589552790341e-05,False,,0.017929436049442415,True,0.8,1,group,True,0.25,0.0010473500400905293,1,COMPLETE
98,0.7823333333333333,0.7,2025-05-08 23:24:14.915999,2025-05-08 23:24:30.964763,0 days 00:00:16.048764,fpgm,True,0.0004547138477909778,0.0010815382233164967,True,0.2,0.042340511796718196,True,0.7,3,base,True,0.30000000000000004,4.7228497231357836e-05,1,COMPLETE
99,0.758,0.7,2025-05-08 23:24:30.987476,2025-05-08 23:24:42.451576,0 days 00:00:11.464100,lamp,False,0.00017061117751405585,0.0039236670312870325,True,0.35000000000000003,0.0022100686387171798,False,0.7,1,base,False,,0.0017254770511885768,1,COMPLETE
