number,values_0,values_1,datetime_start,datetime_complete,duration,params_imp_type,params_isomorphic,params_lr,params_mpp_lr,params_mpp_scheduler,params_mpp_warnup,params_mpp_weight_decay,params_prune_mlp,params_prune_rate,params_prune_step,params_prune_type,params_scheduler,params_warnup,params_weight_decay,system_attrs_NSGAIISampler:generation,state
0,0.8166666666666668,0.7,2025-05-08 23:02:27.956207,2025-05-08 23:02:44.640377,0 days 00:00:16.684170,group,True,0.007346349861436275,0.0009293589851901402,False,,0.03205637227333323,False,0.7,3,bnscale,True,0.0,7.428695154613912e-05,0,COMPLETE
1,0.7873333333333333,0.5,2025-05-08 23:02:44.662861,2025-05-08 23:02:55.494192,0 days 00:00:10.831331,lamp,True,6.626858087113647e-05,0.0031694882677673034,True,0.25,0.020626988006341117,False,0.5,1,bnscale,False,,0.007937806508828173,0,COMPLETE
2,0.49300000000000005,0.8,2025-05-08 23:02:55.513173,2025-05-08 23:03:10.652938,0 days 00:00:15.139765,fpgm,False,1.385581845184494e-05,0.00036995593873408427,True,0.05,1.1420625591079933e-05,False,0.8,3,group,False,,7.696266999507813e-05,0,COMPLETE
3,0.7596666666666666,0.8,2025-05-08 23:03:10.677286,2025-05-08 23:03:23.646810,0 days 00:00:12.969524,group,True,0.00019498016487178482,0.00883777423335351,False,,0.00017902989382294086,False,0.8,2,group,False,,0.005714504632302734,0,COMPLETE
4,0.8233333333333333,0.5,2025-05-08 23:03:23.670870,2025-05-08 23:03:38.959061,0 days 00:00:15.288191,fpgm,True,0.001095975405995615,0.0008161414858047086,False,,3.69103731157579e-05,True,0.5,3,bnscale,True,0.05,0.0727435113348339,0,COMPLETE
5,0.803,0.6,2025-05-08 23:03:38.981309,2025-05-08 23:03:54.186671,0 days 00:00:15.205362,group,False,0.0007169704947021829,5.513575021987841e-05,False,,0.006942484857102518,True,0.6,3,base,False,,3.230886895407689e-05,0,COMPLETE
6,0.771,0.8,2025-05-08 23:03:54.210857,2025-05-08 23:04:07.134615,0 days 00:00:12.923758,group,True,0.0005635317259241016,0.00204050064752189,True,0.35000000000000003,0.08621254259605375,False,0.8,2,bnscale,True,0.0,2.5275935054040677e-05,0,COMPLETE
7,0.8209999999999998,0.6,2025-05-08 23:04:07.157259,2025-05-08 23:04:22.389220,0 days 00:00:15.231961,fpgm,True,0.0016566513052075171,0.00021971842722664467,True,0.45,3.268112256460199e-05,False,0.6,3,group,False,,0.007022904861870334,0,COMPLETE
8,0.773,0.9,2025-05-08 23:04:22.412596,2025-05-08 23:04:37.596086,0 days 00:00:15.183490,group,False,0.0009553030447300765,4.289260412404378e-05,False,,1.541126766924437e-05,False,0.9,3,base,True,0.30000000000000004,0.25181886985942936,0,COMPLETE
9,0.7033333333333335,0.6,2025-05-08 23:04:37.620974,2025-05-08 23:04:50.658848,0 days 00:00:13.037874,group,True,4.7518775544817685e-05,0.0012196472573227013,False,,0.01363124831526979,False,0.6,2,base,False,,0.0020451315368996787,0,COMPLETE
10,0.6943333333333334,0.8,2025-05-08 23:04:50.680585,2025-05-08 23:05:02.117163,0 days 00:00:11.436578,fpgm,False,0.00016248289409594052,0.00594087738389514,True,0.2,0.8368210766661452,True,0.8,1,group,True,0.30000000000000004,0.0004112582706571729,0,COMPLETE
11,0.2896666666666667,0.9,2025-05-08 23:05:02.141108,2025-05-08 23:05:15.475802,0 days 00:00:13.334694,fpgm,False,3.167863722505162e-05,3.0267922912448244e-05,True,0.5,0.0012412868359139848,True,0.9,2,base,True,0.30000000000000004,1.350176001223154e-05,0,COMPLETE
12,0.8106666666666666,0.8,2025-05-08 23:05:15.503237,2025-05-08 23:05:31.057150,0 days 00:00:15.553913,fpgm,False,0.0013213001570845813,3.182002890227902e-05,True,0.05,0.0001333891461790462,False,0.8,3,base,False,,0.013025844590593572,0,COMPLETE
13,0.30033333333333334,0.8,2025-05-08 23:05:31.559831,2025-05-08 23:05:47.556752,0 days 00:00:15.996921,group,False,2.7643351916516225e-05,0.004742696157908033,False,,0.00011170227944689261,False,0.8,3,base,False,,0.03519296847582461,0,COMPLETE
14,0.7483333333333334,0.7,2025-05-08 23:05:47.578391,2025-05-08 23:05:58.705161,0 days 00:00:11.126770,lamp,True,0.00013528563688209973,0.0013434864122349936,True,0.25,0.001360622645658067,False,0.7,1,base,True,0.1,8.269712638941811e-05,0,COMPLETE
15,0.8083333333333332,0.6,2025-05-08 23:05:58.724269,2025-05-08 23:06:09.840211,0 days 00:00:11.115942,group,False,0.007976777681897286,9.506540438359696e-05,False,,0.008408160213361464,False,0.6,1,group,True,0.0,0.8341914738516671,0,COMPLETE
16,0.21733333333333335,0.9,2025-05-08 23:06:09.862587,2025-05-08 23:06:23.090216,0 days 00:00:13.227629,fpgm,True,2.1287458945934192e-05,0.00035027290857693027,False,,2.1825935696356143e-05,True,0.9,2,group,True,0.15000000000000002,0.00032937539128622263,0,COMPLETE
17,0.8033333333333333,0.6,2025-05-08 23:06:23.117704,2025-05-08 23:06:36.872151,0 days 00:00:13.754447,lamp,True,0.001408949666300017,1.4624242819867038e-05,True,0.4,0.3804790976535149,True,0.6,2,group,True,0.1,8.690442419979562e-05,0,COMPLETE
18,0.8013333333333333,0.8,2025-05-08 23:06:36.895101,2025-05-08 23:06:48.006154,0 days 00:00:11.111053,fpgm,True,0.0004810514460794317,0.004189571795746271,False,,0.010837596374119903,False,0.8,1,group,True,0.45,0.11787260937071607,0,COMPLETE
19,0.21433333333333335,0.9,2025-05-08 23:06:48.025055,2025-05-08 23:07:03.035775,0 days 00:00:15.010720,fpgm,True,1.209506129528759e-05,0.0023632586522971733,True,0.25,0.13792798110909515,False,0.9,3,base,False,,2.500658530383773e-05,0,COMPLETE
20,0.809,0.5,2025-05-08 23:07:03.057919,2025-05-08 23:07:13.744772,0 days 00:00:10.686853,lamp,False,0.00034316427949793047,2.0526637471475935e-05,True,0.05,0.09537346199801137,True,0.5,1,bnscale,False,,0.00100948407049833,0,COMPLETE
21,0.7813333333333333,0.7,2025-05-08 23:07:13.763357,2025-05-08 23:07:24.422465,0 days 00:00:10.659108,group,False,0.0002818109745647954,2.2929315360055825e-05,True,0.45,0.0044828496353520285,False,0.7,1,group,False,,0.00012078112196940492,0,COMPLETE
22,0.8206666666666665,0.6,2025-05-08 23:07:24.443061,2025-05-08 23:07:39.979641,0 days 00:00:15.536580,group,False,0.006061001304669974,6.773348952132933e-05,True,0.0,0.054026593929634645,False,0.6,3,group,False,,1.622268967011596e-05,0,COMPLETE
23,0.7783333333333333,0.7,2025-05-08 23:07:40.003182,2025-05-08 23:07:50.747883,0 days 00:00:10.744701,group,False,0.00017061117751405585,0.0039236670312870325,True,0.35000000000000003,0.0022100686387171798,True,0.7,1,base,False,,0.0017254770511885768,0,COMPLETE
24,0.6366666666666666,0.8,2025-05-08 23:07:50.766152,2025-05-08 23:08:05.604223,0 days 00:00:14.838071,fpgm,False,0.00016075206172279214,6.002013539834828e-05,True,0.15000000000000002,3.506433890904232e-05,True,0.8,3,base,True,0.05,0.040753905638393394,0,COMPLETE
25,0.706,0.9,2025-05-08 23:08:05.627586,2025-05-08 23:08:20.534989,0 days 00:00:14.907403,group,False,0.0006890698659809933,0.00017203408003363383,True,0.30000000000000004,1.0918536428284536e-05,True,0.9,3,group,True,0.4,0.2210040577864962,0,COMPLETE
26,0.7376666666666667,0.7,2025-05-08 23:08:20.556023,2025-05-08 23:08:35.386931,0 days 00:00:14.830908,group,False,0.00014718499077253288,3.714793106550329e-05,True,0.35000000000000003,0.13621497231089275,False,0.7,3,base,True,0.45,0.0035161703348041114,0,COMPLETE
27,0.8143333333333332,0.8,2025-05-08 23:08:35.408110,2025-05-08 23:08:50.129579,0 days 00:00:14.721469,group,False,0.005400140059344923,0.00014561616600824783,True,0.4,0.018473944858324282,False,0.8,3,group,True,0.1,0.00958246568315487,0,COMPLETE
28,0.7776666666666667,0.8,2025-05-08 23:08:50.152477,2025-05-08 23:09:05.008320,0 days 00:00:14.855843,fpgm,True,0.0008751180873873679,0.00955166213548048,False,,0.00737063395527119,True,0.8,3,group,False,,3.7569350859786746e-05,0,COMPLETE
29,0.8079999999999999,0.5,2025-05-08 23:09:05.030190,2025-05-08 23:09:15.484065,0 days 00:00:10.453875,lamp,False,0.005810620759590985,7.4450588166353e-05,False,,5.679484116531412e-05,True,0.5,1,group,True,0.25,1.510143045777765e-05,0,COMPLETE
30,0.19299999999999998,0.8,2025-05-08 23:09:15.501965,2025-05-08 23:09:28.240787,0 days 00:00:12.738822,lamp,True,1.5388892002604564e-05,8.650961347830607e-05,False,,0.8301169894287633,False,0.8,2,bnscale,False,,0.5344662966213072,0,COMPLETE
31,0.8056666666666668,0.7,2025-05-08 23:09:28.263801,2025-05-08 23:09:43.407778,0 days 00:00:15.143977,fpgm,True,0.00957361376157217,2.992071893340395e-05,True,0.2,0.009246708348584348,True,0.7,3,bnscale,True,0.25,0.00012578563545305755,0,COMPLETE
32,0.5066666666666667,0.8,2025-05-08 23:09:43.433204,2025-05-08 23:09:54.119944,0 days 00:00:10.686740,group,True,4.3593245709282796e-05,3.5589552790341e-05,False,,0.0005563432289672787,False,0.8,1,group,True,0.45,0.0010473500400905293,0,COMPLETE
33,0.763,0.8,2025-05-08 23:09:54.137587,2025-05-08 23:10:04.629556,0 days 00:00:10.491969,lamp,False,0.0003395328706302827,0.00023068683921798083,True,0.2,0.28696501942247665,True,0.8,1,group,True,0.0,1.5214863800383314e-05,0,COMPLETE
34,0.8170000000000001,0.7,2025-05-08 23:10:04.647228,2025-05-08 23:10:17.205979,0 days 00:00:12.558751,group,False,0.002927716071069925,2.1095459788759116e-05,False,,0.1895993859020993,False,0.7,2,bnscale,False,,0.0012647368659529225,0,COMPLETE
35,0.2383333333333333,0.5,2025-05-08 23:10:17.227835,2025-05-08 23:10:29.898786,0 days 00:00:12.670951,lamp,False,1.1639170028511966e-05,7.896457766829112e-05,False,,0.01554374206654501,False,0.5,2,group,True,0.4,0.14430638448032512,0,COMPLETE
36,0.3753333333333333,0.9,2025-05-08 23:10:29.920043,2025-05-08 23:10:42.978034,0 days 00:00:13.057991,group,True,3.887522582731547e-05,0.0010994182912378943,True,0.05,0.9076785407786444,True,0.9,2,base,False,,0.00019123815410159725,0,COMPLETE
37,0.36066666666666664,0.8,2025-05-08 23:10:43.002266,2025-05-08 23:10:53.639408,0 days 00:00:10.637142,group,False,1.0940926887571466e-05,0.00028815862717511143,True,0.15000000000000002,0.32234432677850583,True,0.8,1,bnscale,True,0.35000000000000003,0.002595318835357454,0,COMPLETE
38,0.7836666666666666,0.5,2025-05-08 23:10:53.657054,2025-05-08 23:11:08.617873,0 days 00:00:14.960819,fpgm,False,0.00011990440897157528,0.0010821578945403932,True,0.35000000000000003,2.5545662681916178e-05,True,0.5,3,bnscale,False,,4.614941563251465e-05,0,COMPLETE
39,0.4453333333333333,0.7,2025-05-08 23:11:08.641689,2025-05-08 23:11:21.411328,0 days 00:00:12.769639,fpgm,True,1.7637649776993212e-05,0.0004839146476262926,True,0.45,0.0008910267266300254,True,0.7,2,bnscale,True,0.35000000000000003,0.0006809905577488475,0,COMPLETE
40,0.6493333333333333,0.9,2025-05-08 23:11:21.435416,2025-05-08 23:11:37.896588,0 days 00:00:16.461172,fpgm,True,0.0004547138477909778,0.0010815382233164967,False,,0.042340511796718196,True,0.9,3,base,True,0.4,4.7228497231357836e-05,0,COMPLETE
41,0.7963333333333334,0.8,2025-05-08 23:11:37.918412,2025-05-08 23:11:51.950735,0 days 00:00:14.032323,fpgm,False,0.0077952619942432645,0.00012802008221638822,True,0.0,1.676497458400446e-05,True,0.8,2,group,True,0.2,0.2933663788506773,0,COMPLETE
42,0.7999999999999999,0.8,2025-05-08 23:11:51.975946,2025-05-08 23:12:02.517736,0 days 00:00:10.541790,fpgm,True,0.00035191572109498646,7.119110792490992e-05,True,0.5,0.7967748189696594,True,0.8,1,group,False,,0.07218097045608428,0,COMPLETE
43,0.819,0.6,2025-05-08 23:12:02.536401,2025-05-08 23:12:16.200819,0 days 00:00:13.664418,lamp,False,0.004965070204410068,0.00011302985637155728,False,,0.00011169822107121126,False,0.6,2,bnscale,False,,0.0016693714442968155,0,COMPLETE
44,0.8246666666666665,0.8,2025-05-08 23:12:16.224429,2025-05-08 23:12:31.627185,0 days 00:00:15.402756,group,True,0.006393454307708503,0.001546216276136302,False,,0.00013047821653036239,True,0.8,3,bnscale,True,0.15000000000000002,0.18775178344707813,0,COMPLETE
45,0.7103333333333334,0.7,2025-05-08 23:12:31.653953,2025-05-08 23:12:44.626986,0 days 00:00:12.973033,fpgm,False,5.2381886385508624e-05,0.00042437770609812775,True,0.35000000000000003,0.0016670147218645457,True,0.7,2,group,False,,0.006197335342713306,0,COMPLETE
46,0.7770000000000001,0.5,2025-05-08 23:12:44.650443,2025-05-08 23:12:55.313636,0 days 00:00:10.663193,group,True,7.084748690245169e-05,0.0018756529160875925,False,,3.6250123473866555e-05,False,0.5,1,base,True,0.1,0.014140634129316987,0,COMPLETE
47,0.807,0.5,2025-05-08 23:12:55.331820,2025-05-08 23:13:08.429413,0 days 00:00:13.097593,lamp,True,0.00036382827303909325,2.1804340259973734e-05,True,0.0,0.010013194334139178,False,0.5,2,base,False,,0.00048042866178479637,0,COMPLETE
48,0.8143333333333332,0.6,2025-05-08 23:13:08.451305,2025-05-08 23:13:23.450928,0 days 00:00:14.999623,group,True,0.0011232041525995262,0.0007108408344005356,False,,0.11560743688352852,True,0.6,3,group,False,,0.004225615782818286,0,COMPLETE
49,0.7903333333333333,0.9,2025-05-08 23:13:23.473650,2025-05-08 23:13:34.182908,0 days 00:00:10.709258,fpgm,True,0.005857774530334977,0.00039945878766530646,False,,0.0005106435346844044,True,0.9,1,group,True,0.15000000000000002,3.955310311147025e-05,0,COMPLETE
50,0.8093333333333333,0.6,2025-05-08 23:13:34.200786,2025-05-08 23:13:47.167333,0 days 00:00:12.966547,lamp,False,0.0013213001570845813,1.4624242819867038e-05,True,0.35000000000000003,0.3804790976535149,True,0.6,2,group,False,,8.690442419979562e-05,1,COMPLETE
51,0.8086666666666668,0.7,2025-05-08 23:13:47.189443,2025-05-08 23:13:58.001727,0 days 00:00:10.812284,fpgm,True,0.00957361376157217,2.992071893340395e-05,True,0.4,0.009246708348584348,True,0.7,1,base,True,0.45,8.269712638941811e-05,1,COMPLETE
52,0.758,0.5,2025-05-08 23:13:58.021557,2025-05-08 23:14:08.793078,0 days 00:00:10.771521,group,True,7.084748690245169e-05,4.289260412404378e-05,False,,1.541126766924437e-05,False,0.5,1,base,True,0.4,0.014140634129316987,1,COMPLETE
53,0.8210000000000001,0.9,2025-05-08 23:14:08.810329,2025-05-08 23:14:23.908891,0 days 00:00:15.098562,group,False,0.005400140059344923,0.00014561616600824783,True,0.35000000000000003,0.018473944858324282,True,0.9,3,group,True,0.0,0.00958246568315487,1,COMPLETE
54,0.37333333333333335,0.8,2025-05-08 23:14:23.930760,2025-05-08 23:14:39.451560,0 days 00:00:15.520800,group,True,2.7643351916516225e-05,0.004742696157908033,True,0.15000000000000002,0.13792798110909515,False,0.8,3,base,False,,0.03519296847582461,1,COMPLETE
55,0.4246666666666667,0.7,2025-05-08 23:14:39.477290,2025-05-08 23:14:52.507360,0 days 00:00:13.030070,fpgm,True,1.7637649776993212e-05,0.0004839146476262926,True,0.1,0.0008910267266300254,True,0.7,2,bnscale,True,0.30000000000000004,0.0006809905577488475,1,COMPLETE
56,0.588,0.7,2025-05-08 23:14:52.529652,2025-05-08 23:15:07.936065,0 days 00:00:15.406413,fpgm,False,0.00017061117751405585,0.0039236670312870325,False,,0.0022100686387171798,True,0.7,3,base,True,0.30000000000000004,4.7228497231357836e-05,1,COMPLETE
57,0.8089999999999998,0.6,2025-05-08 23:15:07.959708,2025-05-08 23:15:20.964565,0 days 00:00:13.004857,fpgm,True,0.0004810514460794317,0.0012196472573227013,False,,0.01363124831526979,False,0.6,2,base,True,0.0,0.0020451315368996787,1,COMPLETE
58,0.8169999999999998,0.6,2025-05-08 23:15:20.985888,2025-05-08 23:15:36.060956,0 days 00:00:15.075068,group,True,0.0011232041525995262,0.0007108408344005356,False,,0.11560743688352852,False,0.6,3,group,False,,0.004225615782818286,1,COMPLETE
59,0.8136666666666666,0.6,2025-05-08 23:15:36.086808,2025-05-08 23:15:51.313204,0 days 00:00:15.226396,group,True,0.0011232041525995262,0.0013367329505890445,False,,0.11560743688352852,True,0.6,3,base,False,,0.004225615782818286,1,COMPLETE
60,0.621,0.8,2025-05-08 23:15:51.336405,2025-05-08 23:16:02.128924,0 days 00:00:10.792519,lamp,False,3.109546677663921e-05,7.4450588166353e-05,True,0.0,5.679484116531412e-05,True,0.8,1,group,False,,1.510143045777765e-05,1,COMPLETE
61,0.19933333333333333,0.9,2025-05-08 23:16:02.148454,2025-05-08 23:16:14.877232,0 days 00:00:12.728778,fpgm,True,2.1287458945934192e-05,0.00035027290857693027,False,,2.1825935696356143e-05,True,0.9,2,group,True,0.45,0.0031443165132600103,1,COMPLETE
62,0.316,0.9,2025-05-08 23:16:14.900207,2025-05-08 23:16:28.381218,0 days 00:00:13.481011,group,True,3.887522582731547e-05,0.0010994182912378943,True,0.45,0.9076785407786444,True,0.9,2,base,False,,0.006337571266862902,1,COMPLETE
63,0.2336666666666667,0.9,2025-05-08 23:16:28.405346,2025-05-08 23:16:43.778404,0 days 00:00:15.373058,group,False,1.6791870831731228e-05,4.289260412404378e-05,False,,1.541126766924437e-05,False,0.9,3,group,True,0.5,0.25181886985942936,1,COMPLETE
64,0.425,0.7,2025-05-08 23:16:43.802859,2025-05-08 23:16:57.157995,0 days 00:00:13.355136,fpgm,True,1.7637649776993212e-05,0.0004839146476262926,True,0.1,0.0008910267266300254,True,0.7,2,bnscale,True,0.30000000000000004,0.0006809905577488475,1,COMPLETE
65,0.3953333333333333,0.9,2025-05-08 23:16:57.179974,2025-05-08 23:17:12.506302,0 days 00:00:15.326328,group,False,6.626858087113647e-05,4.289260412404378e-05,True,0.35000000000000003,0.020626988006341117,False,0.9,3,group,True,0.15000000000000002,0.007937806508828173,1,COMPLETE
66,0.6926666666666668,0.8,2025-05-08 23:17:12.528595,2025-05-08 23:17:25.690303,0 days 00:00:13.161708,fpgm,False,0.00016075206172279214,0.00883777423335351,False,,0.00017902989382294086,False,0.8,2,base,False,,0.040753905638393394,1,COMPLETE
67,0.5479999999999999,0.6,2025-05-08 23:17:25.714852,2025-05-08 23:17:39.028878,0 days 00:00:13.314026,group,False,4.7518775544817685e-05,0.00594087738389514,True,0.15000000000000002,0.01363124831526979,False,0.6,2,base,True,0.1,0.0020451315368996787,1,COMPLETE
68,0.6313333333333334,0.8,2025-05-08 23:17:39.051916,2025-05-08 23:17:49.937432,0 days 00:00:10.885516,fpgm,True,0.00016248289409594052,0.00594087738389514,False,,0.010837596374119903,False,0.8,1,group,True,0.05,0.0004112582706571729,1,COMPLETE
69,0.7443333333333334,0.8,2025-05-08 23:17:49.958037,2025-05-08 23:18:02.680383,0 days 00:00:12.722346,group,True,0.0004810514460794317,0.004189571795746271,False,,0.1895993859020993,False,0.8,2,bnscale,False,,0.11787260937071607,1,COMPLETE
70,0.632,0.8,2025-05-08 23:18:02.701986,2025-05-08 23:18:17.795971,0 days 00:00:15.093985,fpgm,False,0.0009085813003144234,0.001546216276136302,True,0.4,0.37064444659348844,True,0.8,3,group,True,0.45,0.07218097045608428,1,COMPLETE
71,0.8086666666666668,0.8,2025-05-08 23:18:17.819645,2025-05-08 23:18:32.906938,0 days 00:00:15.087293,group,True,0.00035191572109498646,7.119110792490992e-05,True,0.30000000000000004,1.380549408835512e-05,False,0.8,3,group,False,,0.07218097045608428,1,COMPLETE
72,0.7996666666666666,0.8,2025-05-08 23:18:32.928316,2025-05-08 23:18:47.820407,0 days 00:00:14.892091,group,False,0.005400140059344923,0.00014561616600824783,False,,0.00017902989382294086,False,0.8,3,bnscale,True,0.2,0.00958246568315487,1,COMPLETE
73,0.8176666666666667,0.5,2025-05-08 23:18:47.844352,2025-05-08 23:18:58.383583,0 days 00:00:10.539231,fpgm,True,0.005810620759590985,7.4450588166353e-05,False,,0.010837596374119903,False,0.5,1,group,True,0.45,0.001689951031464164,1,COMPLETE
74,0.8053333333333333,0.6,2025-05-08 23:18:58.401595,2025-05-08 23:19:08.971469,0 days 00:00:10.569874,lamp,True,0.0018841276989114222,0.00039550820935782376,False,,0.006942484857102518,True,0.6,1,base,True,0.1,8.269712638941811e-05,1,COMPLETE
75,0.19533333333333333,0.8,2025-05-08 23:19:08.990880,2025-05-08 23:19:24.876505,0 days 00:00:15.885625,fpgm,True,2.384159497617633e-05,0.004189571795746271,False,,3.506433890904232e-05,False,0.8,3,base,True,0.45,0.11787260937071607,1,COMPLETE
76,0.7013333333333334,0.9,2025-05-08 23:19:24.897575,2025-05-08 23:19:37.387087,0 days 00:00:12.489512,fpgm,True,0.0004547138477909778,3.0267922912448244e-05,False,,0.0012412868359139848,True,0.9,2,base,True,0.5,0.03924549914474172,1,COMPLETE
77,0.805,0.5,2025-05-08 23:19:37.409870,2025-05-08 23:19:47.824813,0 days 00:00:10.414943,fpgm,True,0.0002818109745647954,0.0008161414858047086,False,,3.69103731157579e-05,False,0.5,1,bnscale,False,,0.00012078112196940492,1,COMPLETE
78,0.794,0.6,2025-05-08 23:19:47.842803,2025-05-08 23:19:58.202140,0 days 00:00:10.359337,group,True,0.0004810514460794317,0.004189571795746271,False,,0.010837596374119903,False,0.6,1,base,True,0.30000000000000004,0.0020451315368996787,1,COMPLETE
79,0.8006666666666667,0.6,2025-05-08 23:19:58.219727,2025-05-08 23:20:13.028385,0 days 00:00:14.808658,group,False,0.004965070204410068,0.00011302985637155728,False,,0.00011169822107121126,False,0.6,3,base,False,,0.25181886985942936,1,COMPLETE
80,0.5323333333333333,0.9,2025-05-08 23:20:13.050444,2025-05-08 23:20:23.673463,0 days 00:00:10.623019,fpgm,False,0.00016248289409594052,0.00017203408003363383,True,0.0,1.0918536428284536e-05,True,0.9,1,group,True,0.35000000000000003,0.0004112582706571729,1,COMPLETE
81,0.7933333333333334,0.8,2025-05-08 23:20:23.692511,2025-05-08 23:20:38.533626,0 days 00:00:14.841115,fpgm,True,0.0013213001570845813,3.182002890227902e-05,True,0.35000000000000003,0.042340511796718196,False,0.8,3,base,True,0.0,4.7228497231357836e-05,1,COMPLETE
82,0.8376666666666667,0.5,2025-05-08 23:20:38.556536,2025-05-08 23:20:53.831612,0 days 00:00:15.275076,fpgm,True,0.0010699368259333116,4.289260412404378e-05,False,,0.17481415298317282,False,0.5,2,base,True,0.15000000000000002,0.25181886985942936,1,COMPLETE
83,0.8056666666666666,0.8,2025-05-08 23:20:53.854395,2025-05-08 23:21:09.025038,0 days 00:00:15.170643,fpgm,True,0.0077952619942432645,0.001546216276136302,False,,1.676497458400446e-05,True,0.8,3,group,True,0.15000000000000002,0.18775178344707813,1,COMPLETE
84,0.5513333333333333,0.9,2025-05-08 23:21:09.050354,2025-05-08 23:21:24.293693,0 days 00:00:15.243339,fpgm,False,0.0004547138477909778,0.00012802008221638822,True,0.5,0.042340511796718196,True,0.9,3,group,True,0.1,0.2933663788506773,1,COMPLETE
